{
  "ok": true,
  "schema_version": "1.0",
  "request_id": "request-apply-01",
  "phase": "apply",
  "data": {
    "receipt": {
      "operation_id": "operation-01",
      "target": {
        "mode": "session",
        "engine_id": "editor-engine",
        "instance_id": "instance-01",
        "object_id": "document-01",
        "locator": "session://instance-01/document-01"
      },
      "authorization_scope_id": "scope-isolated-01",
      "effects": [
        "change"
      ],
      "snapshot_before": {
        "id": "snapshot-01",
        "source": "live",
        "revision": "memory-01",
        "observed_at": "2026-10-02T00:00:00Z",
        "dependencies": [
          {
            "identity": "template-01",
            "revision": "sha256:aaaaaaaaaaaaaaaaaaaaaaaaaaaaaaaaaaaaaaaaaaaaaaaaaaaaaaaaaaaaaaaa"
          }
        ]
      },
      "snapshot_after": {
        "id": "snapshot-01",
        "source": "live",
        "revision": "memory-01",
        "observed_at": "2026-10-02T00:00:00Z",
        "dependencies": [
          {
            "identity": "template-01",
            "revision": "sha256:aaaaaaaaaaaaaaaaaaaaaaaaaaaaaaaaaaaaaaaaaaaaaaaaaaaaaaaaaaaaaaaa"
          }
        ]
      },
      "outcome": {
        "execution": "completed",
        "change": "not_applied",
        "persistence": "unchanged",
        "verification": {
          "status": "not_run",
          "scope": "no_change_no_postconditions",
          "snapshot_id": null,
          "coverage": "none",
          "checks": [],
          "not_checked": [],
          "evidence_refs": []
        }
      },
      "changed_items": [],
      "artifacts": [],
      "recovery": {
        "action": "none",
        "reason": "Declared in-memory operation verified; save was not requested.",
        "supported": true
      }
    }
  },
  "meta": {
    "duration_ms": 12
  }
}
